<?xml version="1.0" encoding="UTF-8"?>
<!-- edited with XMLSpy v2010 rel. 3 sp1 (x64) (http://www.altova.com) by Shawn S Miller (private) -->
<xs:schema xmlns:xs="http://www.w3.org/2001/XMLSchema">
	<xs:element name="language">
		<xs:complexType>
			<xs:simpleContent>
				<xs:extension base="xs:string">
					<xs:attribute name="value" use="required">
						<xs:simpleType>
							<xs:restriction base="xs:string">
								<xs:enumeration value="en-us"/>
								<xs:enumeration value="fr-ca"/>
								<xs:enumeration value="en-ca"/>
							</xs:restriction>
						</xs:simpleType>
					</xs:attribute>
				</xs:extension>
			</xs:simpleContent>
		</xs:complexType>
	</xs:element>
	<xs:element name="lang">
		<xs:annotation>
			<xs:documentation>Root</xs:documentation>
		</xs:annotation>
		<xs:complexType>
			<xs:sequence>
				<xs:element ref="key" maxOccurs="unbounded"/>
			</xs:sequence>
		</xs:complexType>
	</xs:element>
	<xs:element name="key">
		<xs:complexType>
			<xs:sequence>
				<xs:element ref="language" maxOccurs="unbounded"/>
				<xs:element ref="comments" minOccurs="0"/>
			</xs:sequence>
			<xs:attribute name="value" use="required"/>
			<xs:attribute name="type" use="required"/>
		</xs:complexType>
	</xs:element>
	<xs:element name="comments">
		<xs:complexType>
			<xs:sequence>
				<xs:element ref="comment" maxOccurs="unbounded"/>
			</xs:sequence>
		</xs:complexType>
	</xs:element>
	<xs:element name="comment">
		<xs:complexType>
			<xs:simpleContent>
				<xs:extension base="xs:string">
					<xs:attribute name="date" use="required"/>
					<xs:attribute name="user" use="required"/>
				</xs:extension>
			</xs:simpleContent>
		</xs:complexType>
	</xs:element>
</xs:schema>
